{
  "schema_version": "comparison_input_v2",
  "system": "substitute",
  "scenario_id": "SUBSTITUTE_SCENARIO_MINIMAL_CONTINUATION_006",
  "scenario_class": "minimal_identity_repair_contour",
  "task_class": "bounded_router_trigger_fix",
  "path_id": "manual_identity_repair_checklist_simple",
  "substitute_stack": "manual_identity_repair_checklist_simple",
  "substitute_family": "simple_manual_repair_stack",
  "closure_result": "ACCEPTED",
  "blocker_to_closure_cycles": 2,
  "false_success_risk": "MEDIUM",
  "proof_completeness": "MEDIUM",
  "recovery_cost": "MEDIUM",
  "coordination_overhead": "LOW",
  "operator_minutes": 12,
  "intervention_count": 2,
  "repair_cycles": 2,
  "invalidation_count": 1,
  "closure_latency_minutes": 16,
  "false_green_exposure": 1,
  "artifact_completeness_percent": 58,
  "notes": "a simple manual checklist can repair this contour, but it relies on the operator to preserve identity truth and closure discipline by hand"
}
