{
  "schema_version": "comparison_input_v2",
  "system": "substitute",
  "scenario_id": "SUBSTITUTE_SCENARIO_COMPOUND_001",
  "scenario_class": "compound_proof_sensitive_repair",
  "task_class": "bounded_router_trigger_fix",
  "path_id": "ci_approval_checklist",
  "substitute_stack": "ci_approval_checklist",
  "substitute_family": "approval_gate_stack",
  "closure_result": "ACCEPTED",
  "blocker_to_closure_cycles": 2,
  "false_success_risk": "HIGH",
  "proof_completeness": "MEDIUM",
  "recovery_cost": "HIGH",
  "coordination_overhead": "MEDIUM",
  "operator_minutes": 29,
  "intervention_count": 3,
  "repair_cycles": 1,
  "invalidation_count": 0,
  "closure_latency_minutes": 38,
  "false_green_exposure": 3,
  "artifact_completeness_percent": 45,
  "notes": "CI plus approval and checklist cannot preserve continuation truth through compound repair"
}
