{
  "schema_version": "comparison_input_v2",
  "system": "substitute",
  "scenario_id": "SUBSTITUTE_SCENARIO_CONVERGENCE_002",
  "scenario_class": "stalled_repair_loop_control",
  "task_class": "bounded_router_trigger_fix",
  "path_id": "manual_retry_loop_with_notes",
  "substitute_stack": "manual_retry_loop_with_notes",
  "substitute_family": "manual_retry_stack",
  "closure_result": "ACCEPTED",
  "blocker_to_closure_cycles": 4,
  "false_success_risk": "HIGH",
  "proof_completeness": "LOW",
  "recovery_cost": "HIGH",
  "coordination_overhead": "LOW",
  "operator_minutes": 14,
  "intervention_count": 2,
  "repair_cycles": 4,
  "invalidation_count": 0,
  "closure_latency_minutes": 19,
  "false_green_exposure": 3,
  "artifact_completeness_percent": 35,
  "notes": "manual retry notes do not stop a stalled loop before the next blind retry"
}
