{
  "schema_version": "comparison_input_v2",
  "system": "substitute",
  "scenario_id": "SUBSTITUTE_SCENARIO_EXTERNAL_DOCTOR_004",
  "scenario_class": "externalish_repeated_doctor_contour",
  "task_class": "bounded_router_trigger_fix",
  "path_id": "manual_resume_triage_sheet",
  "substitute_stack": "manual_resume_triage_sheet",
  "substitute_family": "manual_resume_triage_stack",
  "closure_result": "BLOCKED",
  "blocker_to_closure_cycles": 2,
  "false_success_risk": "MEDIUM",
  "proof_completeness": "MEDIUM",
  "recovery_cost": "MEDIUM",
  "coordination_overhead": "LOW",
  "operator_minutes": 14,
  "intervention_count": 2,
  "repair_cycles": 3,
  "invalidation_count": 0,
  "closure_latency_minutes": 18,
  "false_green_exposure": 1,
  "artifact_completeness_percent": 52,
  "notes": "a manual resume triage sheet can keep the repeated-doctor contour moving, but bounded history, reading coherence, and explicit stop semantics stay operator-dependent"
}
