{
  "schema_version": "comparison_input_v2",
  "system": "substitute",
  "scenario_id": "SUBSTITUTE_SCENARIO_WEAK_005",
  "scenario_class": "low_risk_honesty_restoration",
  "task_class": "honesty_restoration_guard",
  "path_id": "bounded_patch_validation_loop",
  "substitute_stack": "bounded_patch_validation_loop",
  "substitute_family": "lightweight_patch_stack",
  "closure_result": "ACCEPTED",
  "blocker_to_closure_cycles": 0,
  "false_success_risk": "LOW",
  "proof_completeness": "MEDIUM",
  "recovery_cost": "LOW",
  "coordination_overhead": "LOW",
  "operator_minutes": 9,
  "intervention_count": 1,
  "repair_cycles": 0,
  "invalidation_count": 0,
  "closure_latency_minutes": 12,
  "false_green_exposure": 0,
  "artifact_completeness_percent": 66,
  "notes": "the lightweight bounded patch loop still remains a plausible non-Synrail option on the weak path"
}
